title,description,rating,link,date,mine,tags,comment,visibility,istop,istopmanga,picurl
崇祯传,樊树志 / 1997 / 人民出版社,8.4,https://book.douban.com/subject/1048535/,2026-01-04 23:40:24,4.0,"历史,中国,传记",写得确实引人入胜，虽然有些史料未免过于野了（点名《明季北略》，简直是在写寓言）。崇祯所面对的局面确实太严酷了，他无非是想依靠一个有能力的人，却不幸走马灯换了无数个却终未寻到。,public,,,https://img9.doubanio.com/view/subject/l/public/s1716506.jpg
将熟悉变为陌生,[英] 齐格蒙·鲍曼 [瑞士] 彼得·哈夫纳 / 2023 / 南京大学出版社,8.7,https://book.douban.com/subject/36409321/,2026-01-02 22:04:36,5.0,"社会学,访谈",太赞了。虽然有点散，但问题意识和思考都太闪闪发光了，划了好多线。书里有对我们处在怎样的一个时代的精辟分析（尽管没有解答）。不得不说，这本书很适合被冠作另一本访谈集的名字，是采访梁漱溟的《这个世界会好吗？》，而且更名副其实，精彩程度至少是那本书的一万多倍,public,,,https://img3.doubanio.com/view/subject/l/public/s34593512.jpg
明代国家权力结构及运行机制,方志远 / 2024 / 广西师范大学出版社,9.2,https://book.douban.com/subject/36594961/,2025-12-30 18:19:10,5.0,"古代史,中国,明史",蔚为大观，极其翔实的同时难得又没什么废笔，几乎每章都有看穿表面现象直达背后成因的分析，比如对巡抚的反复废设是中央朝廷不想地方权力过大，本能地只想让巡抚成为临时官职，与明朝中后期社会矛盾渐大，非加强地方不可的矛盾。非常赞，真正的悼明之作,public,,,https://img1.doubanio.com/view/subject/l/public/s34791168.jpg
天国之秋,[美] 裴士锋 / 2014 / 社会科学文献出版社,8.6,https://book.douban.com/subject/25938605/,2025-12-29 20:40:12,4.0,"中国历史,历史,近代史",前70%都很精彩流畅，最后渐渐絮叨起来，但总体仍然很好，知道了许多之前闻所未闻的视角和细节,public,,,https://img2.doubanio.com/view/subject/l/public/s28386971.jpg
一间只属于自己的房间,[英] 弗吉尼亚·伍尔夫 / 2019 / 天津人民出版社,9.2,https://book.douban.com/subject/34835082/,2025-12-23 22:10:29,5.0,女性主义,因为这是一场写给女性的演讲，身为男性写评论似乎很奇怪。我只是想感叹，文笔和思路都太灵动了，从最开始便被抓住，一直顺畅地被带到最后。你仿佛在看着作者的思路在流淌，变化，最后定型。里面的女性主义意识至今依然犀利。“两个性别的人应该互相帮助，互相描述对方脑后的那块盲区。”必须提一句，这么流畅恐怕译者也有功劳。,public,,,https://img1.doubanio.com/view/subject/l/public/s34848979.jpg
爱的艺术,[美]弗洛姆 / 2011 / 上海译文出版社,8.9,https://book.douban.com/subject/5991872/,2025-12-22 20:15:29,5.0,"爱情,弗洛姆,心理学",弗洛姆果然太棒了。这本书可以看作是《逃避自由》的爱情版DLC，那本书说，真正知道自己在干什么，真正「活着」的人才有可能自由，这本书则是，这样的人才能真正「爱」——不管是爱自己，还是爱别人。爱是给予而不是获取，爱是创造而不是消费，爱是真诚的互相了解而不是满足「像在爱的」符号。「爱不是一种与人的成熟程度无关，只需要投入身心的感情」。,public,,,https://img9.doubanio.com/view/subject/l/public/s6772445.jpg
亲密关系（第6版）,[美] 罗兰·米勒 / 2015 / 人民邮电出版社,9.2,https://book.douban.com/subject/26585065/,2025-12-21 19:26:18,5.0,"爱情,社会学,科普,女性,心理学",2020年开始读，中间停了好几年，终于读完。感觉这绝对可以算作所有想进入亲密关系的人都要读的书，至少比读某些神棍书籍、关注某些神棍公众号/微博、甚至相信什么PUA理论要强多了。在现在这个日渐割裂的社会，能让男性和女性之间多一些互相了解和同理心的书，多一个人读都是好的,public,,,https://img3.doubanio.com/view/subject/l/public/s34340992.jpg
现代中国的形成（1600—1949）,李怀印 / 2022 / 广西师范大学出版社,8.8,https://book.douban.com/subject/35662692/,2025-12-21 11:45:54,4.0,"历史,中国,近代史",开篇第一章基本上就是整本书了，后面只是详细论述而已。还算是不错的近代史综述，但颇有中国特殊论之感，可取的是其视角的宏大，且偏于财政的汲取（虽然确实很重要），可作为一种参考。也有一些重要的重新评价，比如清末新政的作用、宋子文的财政改革能力等等,public,,,https://img3.doubanio.com/view/subject/l/public/s34084367.jpg
日暮乾清门,李文杰 / 2020 / 上海人民出版社,8.8,https://book.douban.com/subject/35065031/,2025-12-19 23:46:42,5.0,"近代,历史,中国",很不错哎，久违的看进历史缝隙中的感觉，清末各种大事件中那些不为人知的细节被关注和讲述，许多之前从未听说的知识。开篇序文里作者说得特别好，专业论文大众看不懂，但只要换个讲述方法，照样可以做到让普通人也喜闻乐见，作者不仅做到了，而且做得极好,public,,,https://img1.doubanio.com/view/subject/l/public/s33662978.jpg
国会现场,叶曙明 / 2013 / 浙江人民出版社,8.3,https://book.douban.com/subject/23116732/,2025-12-06 20:45:52,5.0,"中国,历史,中国史,政治",一本对孙中山的祛魅读物。,public,,,https://img3.doubanio.com/view/subject/l/public/s26261183.jpg
乡土重建,费孝通 / 2022 / 湖南人民出版社,9.2,https://book.douban.com/subject/35897602/,2025-11-29 20:50:18,5.0,"费孝通,回龙观图书馆,社会学,经济学,中国",图书馆速读。很适合搭配《华北的小农经济与社会变迁》一起看，书中提到的难题那本书里分析得更细致，当然这本书是找解药，很意外地看到了费老提了乡镇企业的雏形，用现代化的分散的轻工业来替代被冲击的旧式家庭手工业，确实是很有创见的解法，也能更好地理解前面提到的那本书了。,public,,,https://img9.doubanio.com/view/subject/l/public/s34217584.jpg
到后台看历史卸妆,葛兆光 / 2021 / 四川人民出版社,8.0,https://book.douban.com/subject/35632084/,2025-11-29 19:48:53,2.0,"回龙观图书馆,随笔,历史",图书馆速读。很散的随笔集，一般。写宋人作茧自缚由注意不要向北方外泄情报到最终只能由国家审定出版物的故事挺有意思，还有写明朝太监出使朝鲜索贿可窥见晚明实救无可救。,public,,,https://img1.doubanio.com/view/subject/l/public/s34021928.jpg
紫禁城里的时间映像,赵琰哲 / 2023 / 广西师范大学出版社,7.6,https://book.douban.com/subject/36472545/,2025-11-24 17:50:53,4.0,"回龙观图书馆,历史,艺术史",图书馆速读。视角和介绍的内容都很有意思，许多之前不知道的东西。乾隆这一生实在是精力太旺盛了,public,,,https://img3.doubanio.com/view/subject/l/public/s34636893.jpg
AI新生,［美］斯图尔特·罗素（Stuart Russell） / 2020 / 中信出版社,7.1,https://book.douban.com/subject/35149258/,2025-11-23 20:01:58,2.0,"回龙观图书馆,AI,科普",图书馆速读。涉及到技术细节的全都过时……后面笼统探讨AGI的部分还算可以，但也很不过瘾，稍微有点有趣的就没深入了。替代阿西莫夫定律的几个原则还挺有趣的（利他主义、谦卑、保持学习人类偏好）,public,,,https://img9.doubanio.com/view/subject/l/public/s33720166.jpg
为什么伟大不能被计划,[美] 肯尼斯·斯坦利 [美] 乔尔·雷曼 / 2023 / 中译出版社,7.1,https://book.douban.com/subject/36357804/,2025-11-23 17:49:59,4.0,回龙观图书馆,图书馆速读。看了前言基本上就等于看完了的书，后面就在反复举例子而已。观点也就是标题，真正前沿的突破无法被计划/集中力量办大事，与其执着于遥远的目标不如把重点放在“有趣”的下一步上。,public,,,https://img1.doubanio.com/view/subject/l/public/s34500458.jpg
意识探秘,[美] 克里斯托夫·科赫 / 2012 / 上海科学技术出版社,8.8,https://book.douban.com/subject/6861475/,2025-11-19 23:07:16,5.0,科普,十几年了，终于读完QAQ 虽然还是跳过了最开始过于细节的视觉章节，后面就有趣得多。讲人类日常生活绝大多数的本能反应都是靠「僵尸系统」，只有最关键的值得动用意识；以及大脑中也许有个「超意识」区域在不停处理汇总信息（但它自己却没意识）这两点印象最深。,public,,,https://img1.doubanio.com/view/subject/l/public/s11159140.jpg
显微镜下的古人生活,《新周刊》杂志社 编著 / 2020 / 岳麓书社,6.4,https://book.douban.com/subject/35051012/,2025-11-17 11:38:57,4.0,"历史,科普,中国,文化",应该是在宁波的西西弗书店买的纪念书，终于拆开看完。还是很不错的文集，分数有点太低了。本书又可以叫《为宋朝正名》（bushi,public,,,https://img9.doubanio.com/view/subject/l/public/s33633016.jpg
康熙：重构一位中国皇帝的内心世界,[美] 史景迁 / 2011 / 广西师范大学出版社,7.5,https://book.douban.com/subject/5917239/,2025-11-11 17:09:35,2.0,"历史,史景迁,多抓鱼",终于读掉。体例确实太奇怪了，可以想见在浩如烟海的文献中专门找出对应的章节汇总在一起很是费力，但呈现的效果却不伦不类。译文转译为文言文加重了这一点，但想来想去不这么译的话又和最后一章连不上，无解。,public,,,https://img9.doubanio.com/view/subject/l/public/s6274235.jpg
清代地方政府,瞿同祖 / 2022 / 新星出版社,9.3,https://book.douban.com/subject/35713871/,2025-11-05 22:17:34,5.0,"历史,社会,中国,回龙观图书馆",篇幅其实不长，有一半是注释。十分精当地介绍了清朝州县一级的具体结构和运作方式，在过去的通讯条件下其基层的这种「大撒把」式运作也是某种必然。让ChatGPT区分了下哪些是中国社会特有的，它说一是自治权为零；二是行政成本刻意让地方自行消化，且默认陋规；三是官吏分开，官有权无基层经验，吏有经验却无权。最后结论部分作者说，在这种制度下「所有参与者都攫取了最大的利益，除了底层百姓」,public,,,https://img1.doubanio.com/view/subject/l/public/s34114278.jpg
拾年,王军 / 2012 / 生活·读书·新知三联书店,7.3,https://book.douban.com/subject/11615872/,2025-11-03 18:40:44,4.0,"北京,建筑,规划,回龙观图书馆",速读。真正的字字血泪。但选文确实多重复。,public,,,https://img2.doubanio.com/view/subject/l/public/s11195871.jpg
华北的小农经济与社会变迁,黄宗智 / 2023 / 广西师范大学出版社,9.3,https://book.douban.com/subject/36077792/,2025-11-01 23:27:53,5.0,"社会学,中国",补标。才知道是这本书最早提出的「内卷」一词，对华北农村生活状态的生动描绘，竟然刚听说，应该说能与《江村经济》互为补充。由于其百科全书式的性质，我几乎没法概括，总之是阐明了华北农村的农民由于地少人多等自然和社会因素，导致无法实现资本积累、只能不断无限投入生产，哪怕劳动生产率已经低到完全不合算的困境,public,,,https://img9.doubanio.com/view/subject/l/public/s34298414.jpg
建元与改元,辛德勇 / 2013 / 中华书局,9.0,https://book.douban.com/subject/20473479/,2025-11-01 23:04:17,5.0,"历史,中国,中国历史",最好的一本破除「历史学科不需逻辑思维」偏见的书。我显然是没有逐字细读，但速读之下也为作者考证时层层推理之严密而叹服，与之前读过的历史相关主题的科普通俗读物体例都完全不同。里面对汉武帝始创年号时间的考据和王莽时期对年号传至万世心思的考据也都很有意思,public,,,https://img3.doubanio.com/view/subject/l/public/s27466117.jpg
辨色视朝,李文杰 / 2020 / 上海人民出版社,8.7,https://book.douban.com/subject/35251684/,2025-10-06 18:58:48,4.0,"回龙观图书馆,历史,中国,政治",题目很有趣，读下去感觉稍有车轱辘话，但确实填补了对朝会和奏折文书流转这部分流程的空白，讲垂帘听政期间的几次大规模廷议实例、讨论变法时考虑的是传统军权相权之争（以至于反而觉得万事决于上是一种制度优势）、光绪亲政前拿批示奏折练手这些小细节都很有趣，历史和制度的演变自有其规律，这本书提供了不错的视角,public,,,https://img1.doubanio.com/view/subject/l/public/s33763738.jpg
拥抱战败,[美] 约翰·W·道尔 / 2015 / 生活·读书·新知三联书店,9.1,https://book.douban.com/subject/26418529/,2025-10-03 20:27:52,4.0,"回龙观图书馆,日本,二战史,历史",回龙观图书馆。太絮叨了点，事无巨细但感觉又没讲什么真正颠覆的东西,public,,,https://img9.doubanio.com/view/subject/l/public/s34448676.jpg
饥饿的盛世,张宏杰 / 2023 / 重庆出版社,8.3,https://book.douban.com/subject/36215634/,2025-10-02 17:10:04,5.0,"历史,中国,回龙观图书馆",接近五星。文笔极其流畅，通俗地描绘了乾隆朝的诸多面向，由此可以看出当集权发展到极致时的自然演化逻辑（文字狱、敲打官员、禁止民众越级访问等），最终以马戈尔尼使团的东西方不同视角作结，有种浑然天成的宿命感。另外不得不说有些地方用词的既视感都快搂不住了，「九个指头和一个指头」「是大好，不是小好」等等。,public,,,https://img3.doubanio.com/view/subject/l/public/s34601067.jpg
明代政治制度的源流与得失,朱永嘉 / 2023 / 陕西师范大学出版总社,7.7,https://book.douban.com/subject/36224077/,2025-10-01 18:16:20,4.0,"回龙观图书馆,中国",回龙观图书馆，两天速读。说是讲明朝，其实基本分领域把整个帝制时代的沿革梳理了一遍。无甚创见，但理一理还是好的。尤其是放在大历史的尺度看许多制度设计，确实更有趣味。最后的皇明祖训的无用之处亦然。,public,,,https://img1.doubanio.com/view/subject/l/public/s34615520.jpg
世界绘画史,[西]帕斯·加西亚·庞塞·德莱昂 / 广东人民出版社,0.0,https://book.douban.com/subject/36459419/,2025-09-29 20:25:19,4.0,"回龙观图书馆,绘画,艺术",回龙观图书馆速读。相比于文字里提到的东西，图还是太少了。能感到比起之前的宗教画，确实是在达芬奇、缇香时对人物的描绘出现了飞跃，一下就从平面小人变得立体能看了，然后是伦勃朗之类；接下来的飞跃就是特纳那神一般的风景画技法；然后就到了印象派诸杰，这时已经与照相术正面对撞，所以再接下来都是纯粹对不同表现方法的探索，与「美」这件事已经越来越不沾边了，直到后现代艺术那些彻底的瞎画,public,,,https://img3.doubanio.com/view/subject/l/public/s34803333.jpg
把世界交给懂设计的人,,0.0,https://book.douban.com/subject/36962692/,2025-09-29 17:02:19,5.0,"设计,回龙观图书馆",回龙观图书馆速读。竟然这么少评论，这本书在诸多故弄玄虚的设计类书籍里几乎算得上最有建树的那一批了，从头到尾有理有据有案例地拆分出跟有效设计相关的一系列原则。最开始那个巴黎圣母院火灾报警码的案例真是个绝佳的导入材料,public,,,https://img2.doubanio.com/f/frodo/ddc30012b6268cb7371e5e339418018e5fef5e06/pics/subject/book_large.jpg
北京四合院,王佳桓 / 2018 / 北京出版社,0.0,https://book.douban.com/subject/30364803/,2025-09-28 18:02:01,4.0,"回龙观图书馆,建筑,北京",回龙观图书馆，速读。相比于文字，图实在太少了。对于外行人来说，没有图那些介绍文字几乎没有意义。,public,,,https://img3.doubanio.com/view/subject/l/public/s29908902.jpg
西洋镜04,[德]恩斯特•柏石曼 / 2017 / 台海出版社,7.6,https://book.douban.com/subject/26952772/,2025-09-28 12:34:39,4.0,"回龙观图书馆,摄影,历史,中国",题目很有意思，呈现没有刚开始看起来的那么好。作者还是很努力的，但后半本显然没有跟上那位德国摄影师的脚步。另外解释也少，不知限于尺度还是什么。,public,,,https://img9.doubanio.com/view/subject/l/public/s29276224.jpg
中国现代国家的起源,[美] 孔飞力 / 2013 / 生活·读书·新知三联书店,8.7,https://book.douban.com/subject/25750468/,2025-09-27 19:50:07,4.0,"回龙观图书馆,历史,政治,中国",图书馆。问题是好问题，解析也颇有启发，只是还是显得缺乏连贯性和体系性。对于托克维尔《旧制度与大革命》揭示的「国家在演化中自有其继承」的观点颇有意义，对于解释「中国问题」尤其有效，某种程度上是「制度の基因」,public,,,https://img9.doubanio.com/view/subject/l/public/s27100954.jpg
日本国宝解剖书,[日] 佐藤晃子 / 2023 / 新星出版社,8.2,https://book.douban.com/subject/36190158/,2025-09-27 17:43:32,4.0,"文物,历史,日本,回龙观图书馆",图书馆速读。很有趣的一本书，日本式细致的注解，特好,public,,,https://img1.doubanio.com/view/subject/l/public/s34414188.jpg
西洋镜05,[德]格拉夫•楚•卡斯特 / 2017 / 台海出版社,7.8,https://book.douban.com/subject/26952770/,2025-09-27 14:57:14,4.0,"摄影集,回龙观图书馆,历史",回龙观图书馆，速读。涉及到人文相关的都很有趣，比如西安城墙、西安城、大山上自建高墙的村落、白云山的墓葬、兰州城外的墓葬等。这种想在哪拍就飞到哪的生活太酷了,public,,,https://img3.doubanio.com/view/subject/l/public/s29276222.jpg
西洋镜07,[英]菲利斯•比托 / 2017 / 台海出版社,7.4,https://book.douban.com/subject/26952768/,2025-09-27 14:06:46,4.0,"回龙观图书馆,摄影集,历史,中国",图书馆阅览。很珍贵的摄影集，想起前一阵在忽左忽右听到的对老照片的收集。大沽炮台陷落后的两张特别震撼，课本中可能只有一句话，与真的见到守军的尸体体会完全不同。北京城墙原来有锯齿状的结构，似乎也不像瓮城。如此高大的结构竟然都在和平时期被拆了，每次看到还是很生气。,public,,,https://img1.doubanio.com/view/subject/l/public/s29276220.jpg
悉达多,[德] 赫尔曼·黑塞 / 2017 / 天津人民出版社,9.2,https://book.douban.com/subject/26980487/,2025-09-23 20:20:45,2.0,"经典,小说,回龙观图书馆",回龙观图书馆，速读。实在没觉得有多高明，不管是叙事还是寓言的内核均是,public,,,https://img1.doubanio.com/view/subject/l/public/s29396368.jpg
江南陆师学堂总教习骆博凯家书,[德]骆博凯 / 2022 / 南京出版社,0.0,https://book.douban.com/subject/35783445/,2025-09-22 22:30:20,4.0,"历史,书信,中国,回龙观图书馆",偶然看到，很有趣且珍贵的书信集，以一个德国人的视角描写了1896年到1900年左右中国南京一带的风土人情，以及一些对时事的看法。把所有涉及到「南京的夏天太热」相关的文字都删去大概能减少30%的文字（,public,,,https://img1.doubanio.com/view/subject/l/public/s34134339.jpg
企鹅75,保罗·巴克利 编著 / 2022 / 中信出版社,8.0,https://book.douban.com/subject/35771795/,2025-09-21 19:57:31,5.0,"设计,回龙观图书馆",超有趣的一本书，针对同一幅封面，把作者和设计师的评论同时放上来的形式真是绝了。也许这本里面选的许多封面从审美角度并不算「好看」，但大部分称得上「有趣」。尤其看到书籍作者惊讶于自己的书还能被设计师以出人意料的角度诠释的表达，简直是太有意思的互动了。,public,,,https://img9.doubanio.com/view/subject/l/public/s34133335.jpg
误配,[美] 凯特·霍姆斯 / 2023 / 上海三联书店,7.7,https://book.douban.com/subject/36251501/,2025-09-21 17:38:38,3.0,"设计,回龙观图书馆",回龙观图书馆，速读。絮叨疯了简直，也没讲出啥特别的。「包容性设计不是设计一件让所有人都能使用的东西，而是设计一种让每个人都可以与之交互的方法」「残障不等于身体的缺陷，残障等于不匹配的交互方法」这两句还挺有深意的,public,,,https://img1.doubanio.com/view/subject/l/public/s34447480.jpg
城脊(北京中轴线建筑文化研究)(精)/光明社科文库,,0.0,https://book.douban.com/subject/36577401/,2025-09-21 16:56:40,2.0,"回龙观图书馆,建筑,城市规划,北京",回龙观图书馆，速读。为了中轴线申遗的论文集汇编，质量一般，比起知识性，其透露出的任务性尤为可鄙，对于历史上对北京的破坏几乎不提，只做赞颂。,public,,,https://img2.doubanio.com/f/frodo/ddc30012b6268cb7371e5e339418018e5fef5e06/pics/subject/book_large.jpg
敦煌手账,季羡林 / 2023 / 北京联合出版公司,8.3,https://book.douban.com/subject/36579687/,2025-09-21 15:03:18,2.0,回龙观图书馆,在图书馆看到，拿到座位上，然后笑疯了，居然就是一篇文章加后面的空白笔记本，跟封面完全无关，装帧确实还不错但也不至于这样吧,public,,,https://img9.doubanio.com/view/subject/l/public/s34692676.jpg
人居香港,单霁翔 / 2022 / 中国大百科全书出版社,7.1,https://book.douban.com/subject/35889872/,2025-09-21 14:49:42,3.0,"回龙观图书馆,建筑,香港",回龙观图书馆，速读。热评的吐槽非常正确，没有配图太匪夷所思了。介绍得也比较例行公事，「某年某月，我去了某地」然后接一页干巴巴的描写云云。由于之前住过美荷楼的青旅，因此对这个题目有点兴趣，但写得确实一般。看到某熟悉的林姓名字，甚至可能纯粹是政绩工程……对景贤里的换地方案印象很深。,public,,,https://img1.doubanio.com/view/subject/l/public/s34254399.jpg
沉默,[日]远藤周作 / 2023 / 南海出版公司,8.5,https://book.douban.com/subject/36497571/,2025-09-20 15:42:38,4.0,"回龙观图书馆,日本,小说,宗教",回龙观图书馆。恰好前两天在播客评论区看到，就拿来读了，虽然仍然有宗教式的絮叨但还算易读。真正探讨的是在极限状态下何为真正的信仰，形式上的信仰和实质上的信仰有何分别等等。另外不得不说，对于一个纯正的老中人，从小练就的双重思想功夫简直侵入骨髓，踩个圣像算什么，我们从小升旗仪式在不信的状态下表演忠诚都习惯了,public,,,https://img9.doubanio.com/view/subject/l/public/s34652746.jpg
佐藤大：没有废弃方案,【日】佐藤大 / 2017 / 文化发展出版社,8.5,https://book.douban.com/subject/27613238/,2025-09-19 18:33:22,4.0,"设计,日本,回龙观图书馆",回龙观图书馆，速读。详尽的设计流程还是很不错的，虽然有些最终的结果也就那样（比如那套队服……）。某种程度上印证了我之前的观点，就是设计虽然不可缺少创意，但在很大程度上是一整套理性的流程来支撑，而且这一整套流程下来所造成的「结果矩阵」会给人一种震撼的「整套设计」之感,public,,,https://img9.doubanio.com/view/subject/l/public/s32344376.jpg
中国建筑常识,林徽因 / 2017 / 北京理工大学出版社,7.2,https://book.douban.com/subject/27138765/,2025-09-19 17:38:57,4.0,"建筑,回龙观图书馆",回龙观图书馆，速读。确实有点标题党，但文中涉及北京那些被拆掉的城墙和城楼的描写读来仍然令人心疼，尤其里面真挚的呼吁和最终结局的对比。,public,,,https://img1.doubanio.com/view/subject/l/public/s29945490.jpg
觉醒时刻,鲁迅等 / 2023 / 中国画报出版社,8.5,https://book.douban.com/subject/36360830/,2025-09-18 16:59:25,4.0,"回龙观图书馆,中国",回龙观图书馆，速读。结集的初衷不错，读下来有点散，还是要多读各人的文集。然则仅就选篇来讲，仍可一窥五四精神令人感动的遗存，许多至今仍未实现,public,,,https://img9.doubanio.com/view/subject/l/public/s34501765.jpg
人间词话,王国维 / 1998 / 上海古籍出版社,9.1,https://book.douban.com/subject/1203426/,2025-09-18 15:50:44,,"回龙观图书馆,国学,诗词",回龙观图书馆，速读。此种以文言文臧否诗词的书太考验读者的诗词功底了，我怀疑TOP100的地位完全是现代读者被其震慑住了，其本质就是微博式的文学评论嘛。然而我不配打分，仅标记吧。另，读这本书竟然刚第一次知道李白的《忆秦娥·箫声咽》，我们的诗词教育果真有问题。其顶针句式太有韵味了，包括尾句被赞颂的「西风残照，汉家陵阙」的气势,public,,,https://img9.doubanio.com/view/subject/l/public/s1146614.jpg
深度,李锦 / 2015 / 中国言实出版社,6.1,https://book.douban.com/subject/26482085/,2025-09-17 17:41:25,,"回龙观图书馆,中国,当代,社会",回龙观图书馆，速读。以为会是本没啥评论的书，结果看到这么多吐槽笑疯，确实味太大了，简直像是自费出版的自吹自擂之作。第一章的描写还算不错，后面越来越放飞，最后退出体制后写博客和国企改革那段的简直就是纯自吹。就不打分了，毕竟前面还是有一些史学价值的,public,,,https://img1.doubanio.com/view/subject/l/public/s28313088.jpg
